{
  "fixture": true,
  "games": [
    {
      "actual_margin": 44,
      "actual_total": 50,
      "away_points": 3,
      "away_team": "Buffalo",
      "conviction_label": "Clear lean UConn",
      "conviction_team": "UConn",
      "conviction_tier": "clear_lean",
      "game_id": "401629032",
      "grade_status": "graded",
      "graded_from": {
        "published_at": "2024-09-24T10:00:00Z",
        "refresh_kind": "tuesday_primary"
      },
      "home_points": 47,
      "home_team": "UConn",
      "home_win": true,
      "kickoff_utc": "2024-09-28T16:00:00Z",
      "margin_interval_hi": 33.43057161995973,
      "margin_interval_hit": false,
      "margin_interval_lo": -22.239504810459852,
      "margin_interval_nominal": 0.8,
      "mu_margin": 7.595459108729329,
      "mu_total": 47.34971706335511,
      "p_win_home": 0.7180252536131541,
      "p_win_home_realized": 1.0,
      "sigma_margin": 18.86519285012428,
      "total_interval_hi": null,
      "total_interval_hit": null,
      "total_interval_lo": null,
      "total_interval_nominal": null,
      "week": 5
    },
    {
      "actual_margin": 14,
      "actual_total": 28,
      "away_points": 7,
      "away_team": "Illinois",
      "conviction_label": "Clear lean Penn State",
      "conviction_team": "Penn State",
      "conviction_tier": "clear_lean",
      "game_id": "401628495",
      "grade_status": "graded",
      "graded_from": {
        "published_at": "2024-09-24T10:00:00Z",
        "refresh_kind": "tuesday_primary"
      },
      "home_points": 21,
      "home_team": "Penn State",
      "home_win": true,
      "kickoff_utc": "2024-09-28T23:30:00Z",
      "margin_interval_hi": 35.69177780014384,
      "margin_interval_hit": true,
      "margin_interval_lo": -17.130084699316917,
      "margin_interval_nominal": 0.8,
      "mu_margin": 11.628869269714544,
      "mu_total": 55.97311083951215,
      "p_win_home": 0.8212006811793431,
      "p_win_home_realized": 1.0,
      "sigma_margin": 17.399323533686864,
      "total_interval_hi": null,
      "total_interval_hit": null,
      "total_interval_lo": null,
      "total_interval_nominal": null,
      "week": 5
    },
    {
      "actual_margin": 56,
      "actual_total": 70,
      "away_points": 7,
      "away_team": "Ball State",
      "conviction_label": "Strong lean James Madison",
      "conviction_team": "James Madison",
      "conviction_tier": "strong_lean",
      "game_id": "401643793",
      "grade_status": "graded",
      "graded_from": {
        "published_at": "2024-09-24T10:00:00Z",
        "refresh_kind": "tuesday_primary"
      },
      "home_points": 63,
      "home_team": "James Madison",
      "home_win": true,
      "kickoff_utc": "2024-09-28T17:30:00Z",
      "margin_interval_hi": 43.91778602955777,
      "margin_interval_hit": false,
      "margin_interval_lo": -4.681897747749758,
      "margin_interval_nominal": 0.8,
      "mu_margin": 17.735171313639405,
      "mu_total": 53.08784674803578,
      "p_win_home": 0.8964244801962633,
      "p_win_home_realized": 1.0,
      "sigma_margin": 16.27043304151279,
      "total_interval_hi": null,
      "total_interval_hit": null,
      "total_interval_lo": null,
      "total_interval_nominal": null,
      "week": 5
    },
    {
      "actual_margin": 17,
      "actual_total": 31,
      "away_points": 7,
      "away_team": "Middle Tennessee",
      "conviction_label": "Strong lean Memphis",
      "conviction_team": "Memphis",
      "conviction_tier": "strong_lean",
      "game_id": "401641025",
      "grade_status": "graded",
      "graded_from": {
        "published_at": "2024-09-24T10:00:00Z",
        "refresh_kind": "tuesday_primary"
      },
      "home_points": 24,
      "home_team": "Memphis",
      "home_win": true,
      "kickoff_utc": "2024-09-28T23:30:00Z",
      "margin_interval_hi": 50.27907983087679,
      "margin_interval_hit": true,
      "margin_interval_lo": -10.104272907524097,
      "margin_interval_nominal": 0.8,
      "mu_margin": 24.342352378625563,
      "mu_total": 57.245532906644286,
      "p_win_home": 0.9419116459376514,
      "p_win_home_realized": 1.0,
      "sigma_margin": 18.10661754620579,
      "total_interval_hi": null,
      "total_interval_hit": null,
      "total_interval_lo": null,
      "total_interval_nominal": null,
      "week": 5
    },
    {
      "actual_margin": 32,
      "actual_total": 52,
      "away_points": 10,
      "away_team": "South Alabama",
      "conviction_label": "Lean LSU",
      "conviction_team": "LSU",
      "conviction_tier": "lean",
      "game_id": "401628376",
      "grade_status": "graded",
      "graded_from": {
        "published_at": "2024-09-24T10:00:00Z",
        "refresh_kind": "tuesday_primary"
      },
      "home_points": 42,
      "home_team": "LSU",
      "home_win": true,
      "kickoff_utc": "2024-09-28T23:45:00Z",
      "margin_interval_hi": 28.321250136596614,
      "margin_interval_hit": false,
      "margin_interval_lo": -28.680740093694215,
      "margin_interval_nominal": 0.8,
      "mu_margin": 1.0227154484578589,
      "mu_total": 62.41367539255765,
      "p_win_home": 0.6034526051475204,
      "p_win_home_realized": 1.0,
      "sigma_margin": 14.878425309145914,
      "total_interval_hi": null,
      "total_interval_hit": null,
      "total_interval_lo": null,
      "total_interval_nominal": null,
      "week": 5
    },
    {
      "actual_margin": 35,
      "actual_total": 55,
      "away_points": 10,
      "away_team": "South Florida",
      "conviction_label": "Lean Tulane",
      "conviction_team": "Tulane",
      "conviction_tier": "lean",
      "game_id": "401645337",
      "grade_status": "graded",
      "graded_from": {
        "published_at": "2024-09-24T10:00:00Z",
        "refresh_kind": "tuesday_primary"
      },
      "home_points": 45,
      "home_team": "Tulane",
      "home_win": true,
      "kickoff_utc": "2024-09-28T16:00:00Z",
      "margin_interval_hi": 30.233447623919606,
      "margin_interval_hit": false,
      "margin_interval_lo": -29.625289638423627,
      "margin_interval_nominal": 0.8,
      "mu_margin": 1.140193946703766,
      "mu_total": 52.35015198458937,
      "p_win_home": 0.5938161663968116,
      "p_win_home_realized": 1.0,
      "sigma_margin": 19.317738872789327,
      "total_interval_hi": null,
      "total_interval_hit": null,
      "total_interval_lo": null,
      "total_interval_nominal": null,
      "week": 5
    },
    {
      "actual_margin": 20,
      "actual_total": 40,
      "away_points": 10,
      "away_team": "Akron",
      "conviction_label": "Clear lean Ohio",
      "conviction_team": "Ohio",
      "conviction_tier": "clear_lean",
      "game_id": "401644738",
      "grade_status": "graded",
      "graded_from": {
        "published_at": "2024-09-24T10:00:00Z",
        "refresh_kind": "tuesday_primary"
      },
      "home_points": 30,
      "home_team": "Ohio",
      "home_win": true,
      "kickoff_utc": "2024-09-28T19:30:00Z",
      "margin_interval_hi": 37.18003349791256,
      "margin_interval_hit": true,
      "margin_interval_lo": -13.467770959111654,
      "margin_interval_nominal": 0.8,
      "mu_margin": 11.682092709395363,
      "mu_total": 54.12214962335783,
      "p_win_home": 0.8272850289088449,
      "p_win_home_realized": 1.0,
      "sigma_margin": 16.87947417044206,
      "total_interval_hi": null,
      "total_interval_hit": null,
      "total_interval_lo": null,
      "total_interval_nominal": null,
      "week": 5
    },
    {
      "actual_margin": 7,
      "actual_total": 27,
      "away_points": 10,
      "away_team": "Louisiana Tech",
      "conviction_label": "Clear lean Florida International",
      "conviction_team": "Florida International",
      "conviction_tier": "clear_lean",
      "game_id": "401640981",
      "grade_status": "graded",
      "graded_from": {
        "published_at": "2024-09-24T10:00:00Z",
        "refresh_kind": "tuesday_primary"
      },
      "home_points": 17,
      "home_team": "Florida International",
      "home_win": true,
      "kickoff_utc": "2024-09-28T22:00:00Z",
      "margin_interval_hi": 33.15291187148375,
      "margin_interval_hit": true,
      "margin_interval_lo": -16.3733704268652,
      "margin_interval_nominal": 0.8,
      "mu_margin": 7.663402537860144,
      "mu_total": 51.973453432307224,
      "p_win_home": 0.7226519564033816,
      "p_win_home_realized": 1.0,
      "sigma_margin": 18.31262737082104,
      "total_interval_hi": null,
      "total_interval_hit": null,
      "total_interval_lo": null,
      "total_interval_nominal": null,
      "week": 5
    },
    {
      "actual_margin": 31,
      "actual_total": 51,
      "away_points": 10,
      "away_team": "Wagner",
      "conviction_label": "Strong lean Florida Atlantic",
      "conviction_team": "Florida Atlantic",
      "conviction_tier": "strong_lean",
      "game_id": "401645335",
      "grade_status": "graded",
      "graded_from": {
        "published_at": "2024-09-24T10:00:00Z",
        "refresh_kind": "tuesday_primary"
      },
      "home_points": 41,
      "home_team": "Florida Atlantic",
      "home_win": true,
      "kickoff_utc": "2024-09-28T22:00:00Z",
      "margin_interval_hi": 51.0273686270393,
      "margin_interval_hit": true,
      "margin_interval_lo": -3.7608895662368096,
      "margin_interval_nominal": 0.8,
      "mu_margin": 21.08224069615525,
      "mu_total": 52.39606198687945,
      "p_win_home": 0.8941932360328011,
      "p_win_home_realized": 1.0,
      "sigma_margin": 19.4272847122762,
      "total_interval_hi": null,
      "total_interval_hit": null,
      "total_interval_lo": null,
      "total_interval_nominal": null,
      "week": 5
    },
    {
      "actual_margin": 22,
      "actual_total": 48,
      "away_points": 13,
      "away_team": "Mississippi State",
      "conviction_label": "Strong lean Texas",
      "conviction_team": "Texas",
      "conviction_tier": "strong_lean",
      "game_id": "401628378",